id;titel;jaar;taal;looptijd;genre;directeur;acteurs;plot
150;the kissing booth;2018;"[""Engels""]";105;"[""comedy"", ""romance""]";Vince Marcello;Joey King, Joel Courtney & Jacob Elordi;Elle Evans, een zestienjarig meisje, is populair en feest graag maar is nog nooit gekust. De zaken nemen een wending die Elle nooit had verwacht wanneer ze tijdens carnaval terechtkomt bij een attractie genaamd 'kissing booth'. Daar staat ze plots oog in oog met de jongen waar ze al lang verliefd op is - de broer van haar beste vriend, Noah. Elle wordt vervolgens meegesleept in een romance met de coolste jongen op school. 
151;the kissing booth 2;2020;"[""Engels""]";131;"[""comedy"", ""romance""]";Vince Marcello;Joey King, Joel Courtney & Jacob Elordi;Elle's vriendje Noah vertrekt naar Harvard om te gaan studeren. De tortelduifjes doen er alles aan om de langeafstandsrelatie te laten werken. Maar de komst van een aantrekkelijke nieuwe klasgenoot maakt het er voor Elle niet gemakkelijker op. Tot overmaat van ramp dreigt Noah ook te zwichten voor de verleidingen van het studentenleven. Zal de liefde het nieuwe schooljaar overleven? 
152;the kissing booth 3;2021;"[""Engels""]";113;"[""comedy"", ""romance""]";Vince Marcello;Joey King, Joel Courtney & Jacob Elordi;Elle staat voor een grote beslissing. Haar middelbareschooltijd zit erop en ze moet besluiten naar welke universiteit ze gaat. Wordt het Harvard, waar ze bij Noah kan zijn? Of kiest ze voor haar eigen favoriete school, waar toevallig ook Lee naartoe gaat?
153;A California Christmas: City Lights;2021;"[""Engels""]";90;"[""comedy"", ""drama"", ""romance""]";Shaun Piccinino;Lauren Swickard, Josh Swickard & Amanda Detmer;"Vervolg op ""A California Christmas"". Callie en Joseph zijn een jaar een stel geworden en runnen nu een melkveebedrijf en wijnmakerij. Hun romance wordt bedreigd wanneer zakelijke en familiale verplichtingen Joseph terugroepen naar de stad. Kan hun bruiloft waar ze zo naar uitkijken nog doorgaan? "
154;Chernobyl 1986;2021;"[""Russisch""]";136;"[""drama"", ""history"", ""romance""]";Danila Kozlovsky;Danila Kozlovsky, Oksana Akinshina, Filipp Avdeyev, Ravshana Kurkova & Nikolay Kozak  ;Tsjernobyl, 1986. Na een mislukte veiligheidstest in een kerncentrale ontstaat er een explosie met rampzalige gevolgen. Alexey, een brandweerman, gaat op een gevaarlijke missie om water af te voeren uit een reservoir onder de brandende kernreactor. Hij doet dit samen met ingenieur Valery en de militaire duiker Boris. Er is geen tijd voor een goede planning en het water dat ze moeten trotseren wordt met het uur heter. Om een nog grotere ramp te voorkomen zijn de drie mannen bereid hun eigen leven op te offeren. 
155;The dictator;2012;"[""Engels""]";83;"[""comedy""]";Larry Charles;Sacha Baron Cohen, Anna Faris & Ben Kingsley  ;Aladeen (Sacha Baron Cohen) is een rijke en meedogenloze dictator, die wordt gegijzeld. Hij wordt vervangen door een naïeve geitenherder, die als twee druppels water op hem lijkt. Met de hulp van Zoey, een mooie vrijgevige eigenaresse van een Zen Shop, probeert Aladeen zijn macht terug te krijgen. Hij moet koste wat het kost voorkomen dat zijn land in verkeerde handen valt.
156;Mosul;2019;"[""Arabisch""]";101;"[""action"", ""drama"", ""war""]";Matthew Michael Carnahan;Suhail Dabbach, Adam Bessa & Is'Haq Elias;Nadat hij door het Nineveh SWAT-team wordt gered, voegt de jonge politieagent Kawa zich bij de eenheid die door majoor Jasem wordt geleid. Gezamenlijk voeren ze een persoonlijke operatie uit om hun geboortestad Mosul uit handen van IS te bevrijden.
157;De slag om schelde;2021;"[""Nederlands""]";124;"[""war"", ""drama""]";Matthijs van Heijningen jr.;Gijs Blom, Jamie Flatters & Susan Radder;Op het Zeeuwse Walcheren vechten in 1944 tienduizenden geallieerden en Duitsers tegen elkaar. De wegen van een Nederlandse jongen die voor de Duitsers vecht, een verdwaalde Engelse gliderpiloot en een tegen wil en dank in het verzet betrokken Zeeuws meisje kruisen elkaar.
158;The siege of jadootville;2016;"[""Engels""]";108;"[""war"", ""drama"", ""action"", ""history"", ""thriller""]";Richie Smyth;Jamie Dornan, Mark Strong, Mikael Persbrandt, Jason O'Mara, Danny Sapani, Michael McElhatton & Guillaume Canet  ;De film speelt zich af in 1961 ten tijde van de Congo-crisis. Generaal Pat Quinlan en zijn 150 manschappen worden door Hammarskjold van de Verenigde Naties naar de stad gestuurd nadat Katanga zich heeft afgescheiden. Gedurende 6 dagen en nachten worden ze aangevallen door 3000 soldaten van de Katangese regering die worden gesteund door de Franse en Belgische huurlingen die zijn ingehuurd door de mijnbouwbedrijven.
159;Spijt!;2013;"[""Nederlands""]";95;"[""drama"", ""family""]";Dave Schram;Robin Boissevain, Dorus Witte, Stefan Collier, Charlotte Bakker, Nils Verkooijen, Rick van Elk, Gregory Samson, Brahim Fouradi, Fabiënne Bergmans & Dave Mantel;Jochem voelt zich niet erg gelukkig in de tweede klas. Hij is het mikpunt van getreiter. David doet er niet aan mee, maar hij durft er niks van te zeggen. De klassenleraar, die gymnastiek geeft, grijpt ook niet in. Hij heeft een hekel aan dikke Jochem. Jochem lijkt zich niets aan te trekken van de pesterijen, die elke dag erger worden. Als de klas weer eens dubbel ligt, lacht hij zelf mee. Maar op een ochtend krijgen ze van de rector te horen dat Jochem na de klassenavond niet is thuisgekomen. 
160;Achtste-groepers huilen niet;2012;"[""Nederlands""]";99;"[""drama"", ""family"", ""sport""]";Dennis Bots;Hanna Obbeek, Nils Verkooijen & Fiona Livingston;Achtste Groepers Huilen Niet' vertelt het verhaal van de levenslustige Akkie (Hanna Obbeek) die wild is van voetbal, ook al vindt klasgenoot Joep dat voetballen geen meidensport is. Akkie laat zich niet op haar kop zitten en met humor gaat ze tegen zijn pesterijen in. Wanneer ze leukemie krijgt, behoudt Akkie haar optimisme en energie. De hele klas van juf Ina leeft met haar mee en zelfs vanuit het ziekenhuis blijft Akkie zich met het schoolvoetbaltoernooi bemoeien. Als ze zo achteruit gaat dat ze onmogelijk aan het toernooi mee kan doen, bedenkt de stoere Joep een heel bijzonder plan.
161;It;2017;"[""Engels""]";136;"[""horror""]";Andy Muschietti;Jaeden Lieberher, Bill Skarsgård, Jeremy Ray Taylor, Sophia Lillis, Finn Wolfhard, Chosen Jacobs, Jack Dylan Grazer & Wyatt Oleff;Zomer 1989. 'It' volgt een groep kinderen, beter bekend als de 'Losers club', in het kleine stadje Derry, Maine. Op een dag wordt het stadje geterroriseerd door het bloeddorstigste monster It dat het op de kinderen voorzien heeft. Dit monster, dat de vorm van een clown genaamd Pennywise aanneemt, komt lijnrecht tegenover het groepje kinderen te staan dat er alles aan zal moeten doen om het te verdrijven.
162;Spiderman: No way home;2021;"[""Engels""]";148;"[""action"", ""adventure"", ""fantasy"", ""sci-fi""]";Jon Watts;Tom Holland, Tobey Maguire, Andrew Garfield, Zendaya, Jacob Batalon, Marisa Tomei, Benedict Cumberbatch, Jon Favreau, Willem Dafoe, Alfred Molina, Jamie Foxx, Benedict Wong, Tony Revolori, Angourie Rice, Arian Moayed, Paula Newsome, Martin Starr, J.B. Smoove & Hannibal Buress;Nu de ware identiteit van Spider-Man is prijsgegeven, kan Peter zijn normale leven niet langer meer scheiden met dat van zijn rol als superheld. Hij schakelt vervolgens de hulp van Dr. Strange in om dit alles ongedaan te maken. Dit brengt echter enorme risico's met zich mee, waarbij hij gedwongen wordt te ontdekken wat werkelijk nodig is om Spider-Man te zijn.
